<?xml version="1.0" encoding="UTF-8"?>
<!-- 
  SARMS - Smart Academic Records Management System
  Group 1: Student Enrollment System
  
  This XML document stores student enrollment data including
  personal information, enrolled subjects, units, grades, and GPA.
  
  Naming Conventions:
    - Elements/Attributes: camelCase
    - Student IDs: STU-XXX format
    - Subject IDs: SUB-XXX format
-->
<!DOCTYPE students SYSTEM "students.dtd">
<?xml-stylesheet type="text/xsl" href="students.xsl"?>
<students>

  <!-- Student 1: 4th Year BSIT Student -->
  <student studentId="23-00001">
    <firstName>Juan</firstName>
    <lastName>Dela Cruz</lastName>
    <course>BSIT</course>
    <yearLevel>4</yearLevel>
    <enrolledSubjects>
      <subject subjectId="SUB-001">
        <subjectName>Integrative Programming</subjectName>
        <units>3</units>
        <grade>1.25</grade>
      </subject>
      <subject subjectId="SUB-002">
        <subjectName>Capstone Project 2</subjectName>
        <units>3</units>
        <grade>1.50</grade>
      </subject>
      <subject subjectId="SUB-003">
        <subjectName>Information Assurance</subjectName>
        <units>3</units>
        <grade>1.75</grade>
      </subject>
      <subject subjectId="SUB-004">
        <subjectName>Technopreneurship</subjectName>
        <units>3</units>
        <grade>2.00</grade>
      </subject>
    </enrolledSubjects>
    <gpa>1.63</gpa>
  </student>

  <!-- Student 2: 3rd Year BSCS Student -->
  <student studentId="23-00002">
    <firstName>Maria</firstName>
    <lastName>Santos</lastName>
    <course>BSCS</course>
    <yearLevel>3</yearLevel>
    <enrolledSubjects>
      <subject subjectId="SUB-005">
        <subjectName>Data Structures and Algorithms</subjectName>
        <units>3</units>
        <grade>1.00</grade>
      </subject>
      <subject subjectId="SUB-006">
        <subjectName>Operating Systems</subjectName>
        <units>3</units>
        <grade>1.25</grade>
      </subject>
      <subject subjectId="SUB-007">
        <subjectName>Database Management</subjectName>
        <units>3</units>
        <grade>1.50</grade>
      </subject>
    </enrolledSubjects>
    <gpa>1.25</gpa>
  </student>

  <!-- Student 3: 2nd Year BSIT Student -->
  <student studentId="23-00003">
    <firstName>Jose</firstName>
    <lastName>Reyes</lastName>
    <course>BSIT</course>
    <yearLevel>2</yearLevel>
    <enrolledSubjects>
      <subject subjectId="SUB-008">
        <subjectName>Object-Oriented Programming</subjectName>
        <units>3</units>
        <grade>2.50</grade>
      </subject>
      <subject subjectId="SUB-009">
        <subjectName>Discrete Mathematics</subjectName>
        <units>3</units>
        <grade>2.75</grade>
      </subject>
      <subject subjectId="SUB-010">
        <subjectName>Web Development</subjectName>
        <units>3</units>
        <grade>2.25</grade>
      </subject>
      <subject subjectId="SUB-011">
        <subjectName>Platform Technologies</subjectName>
        <units>3</units>
        <grade>3.00</grade>
      </subject>
    </enrolledSubjects>
    <gpa>2.63</gpa>
  </student>

  <!-- Student 4: 1st Year BSIS Student -->
  <student studentId="23-00004">
    <firstName>Ana</firstName>
    <lastName>Garcia</lastName>
    <course>BSIS</course>
    <yearLevel>1</yearLevel>
    <enrolledSubjects>
      <subject subjectId="SUB-012">
        <subjectName>Introduction to Computing</subjectName>
        <units>3</units>
        <grade>1.75</grade>
      </subject>
      <subject subjectId="SUB-013">
        <subjectName>Computer Programming 1</subjectName>
        <units>3</units>
        <grade>2.00</grade>
      </subject>
      <subject subjectId="SUB-014">
        <subjectName>Mathematics in the Modern World</subjectName>
        <units>3</units>
        <grade>2.25</grade>
      </subject>
    </enrolledSubjects>
    <gpa>2.00</gpa>
  </student>

  <!-- Student 5: 4th Year BSCS Student -->
  <student studentId="23-00005">
    <firstName>Carlos</firstName>
    <lastName>Mendoza</lastName>
    <course>BSCS</course>
    <yearLevel>4</yearLevel>
    <enrolledSubjects>
      <subject subjectId="SUB-015">
        <subjectName>Artificial Intelligence</subjectName>
        <units>3</units>
        <grade>1.50</grade>
      </subject>
      <subject subjectId="SUB-016">
        <subjectName>Machine Learning</subjectName>
        <units>3</units>
        <grade>1.25</grade>
      </subject>
      <subject subjectId="SUB-017">
        <subjectName>Software Engineering 2</subjectName>
        <units>3</units>
        <grade>1.75</grade>
      </subject>
      <subject subjectId="SUB-018">
        <subjectName>Research Methods</subjectName>
        <units>3</units>
        <grade>1.50</grade>
      </subject>
    </enrolledSubjects>
    <gpa>1.50</gpa>
  </student>

  <!-- Student 6: 2nd Year BSIS Student -->
  <student studentId="23-00006">
    <firstName>Patricia</firstName>
    <lastName>Villanueva</lastName>
    <course>BSIS</course>
    <yearLevel>2</yearLevel>
    <enrolledSubjects>
      <subject subjectId="SUB-019">
        <subjectName>Systems Analysis and Design</subjectName>
        <units>3</units>
        <grade>3.00</grade>
      </subject>
      <subject subjectId="SUB-020">
        <subjectName>Information Management</subjectName>
        <units>3</units>
        <grade>2.75</grade>
      </subject>
      <subject subjectId="SUB-021">
        <subjectName>Accounting Principles</subjectName>
        <units>3</units>
        <grade>3.00</grade>
      </subject>
    </enrolledSubjects>
    <gpa>2.92</gpa>
  </student>

  <!-- Student 7: 3rd Year BSIT Student -->
  <student studentId="23-00007">
    <firstName>Miguel</firstName>
    <lastName>Torres</lastName>
    <course>BSIT</course>
    <yearLevel>3</yearLevel>
    <enrolledSubjects>
      <subject subjectId="SUB-022">
        <subjectName>Networking Fundamentals</subjectName>
        <units>3</units>
        <grade>1.00</grade>
      </subject>
      <subject subjectId="SUB-023">
        <subjectName>System Administration</subjectName>
        <units>3</units>
        <grade>1.25</grade>
      </subject>
      <subject subjectId="SUB-024">
        <subjectName>Information Assurance</subjectName>
        <units>3</units>
        <grade>1.00</grade>
      </subject>
      <subject subjectId="SUB-025">
        <subjectName>Quantitative Methods</subjectName>
        <units>3</units>
        <grade>1.50</grade>
      </subject>
    </enrolledSubjects>
    <gpa>1.19</gpa>
  </student>

  <!-- Student 8: 1st Year BSIT Student -->
  <student studentId="23-00008">
    <firstName>Angela</firstName>
    <lastName>Ramos</lastName>
    <course>BSIT</course>
    <yearLevel>1</yearLevel>
    <enrolledSubjects>
      <subject subjectId="SUB-026">
        <subjectName>Introduction to Computing</subjectName>
        <units>3</units>
        <grade>2.50</grade>
      </subject>
      <subject subjectId="SUB-027">
        <subjectName>Computer Programming 1</subjectName>
        <units>3</units>
        <grade>2.75</grade>
      </subject>
      <subject subjectId="SUB-028">
        <subjectName>Purposive Communication</subjectName>
        <units>3</units>
        <grade>2.00</grade>
      </subject>
    </enrolledSubjects>
    <gpa>2.42</gpa>
  </student>

  <!-- Student 9: 3rd Year BSIS Student -->
  <student studentId="23-00009">
    <firstName>Rafael</firstName>
    <lastName>Lim</lastName>
    <course>BSIS</course>
    <yearLevel>3</yearLevel>
    <enrolledSubjects>
      <subject subjectId="SUB-029">
        <subjectName>Enterprise Architecture</subjectName>
        <units>3</units>
        <grade>1.75</grade>
      </subject>
      <subject subjectId="SUB-030">
        <subjectName>IT Project Management</subjectName>
        <units>3</units>
        <grade>2.00</grade>
      </subject>
      <subject subjectId="SUB-031">
        <subjectName>Business Process Management</subjectName>
        <units>3</units>
        <grade>1.50</grade>
      </subject>
      <subject subjectId="SUB-032">
        <subjectName>Professional Ethics</subjectName>
        <units>3</units>
        <grade>1.75</grade>
      </subject>
    </enrolledSubjects>
    <gpa>1.75</gpa>
  </student>

  <!-- Student 10: 4th Year BSIT Student (at-risk) -->
  <student studentId="23-00010">
    <firstName>Isabela</firstName>
    <lastName>Cruz</lastName>
    <course>BSIT</course>
    <yearLevel>4</yearLevel>
    <enrolledSubjects>
      <subject subjectId="SUB-033">
        <subjectName>Capstone Project 2</subjectName>
        <units>3</units>
        <grade>3.00</grade>
      </subject>
      <subject subjectId="SUB-034">
        <subjectName>Technopreneurship</subjectName>
        <units>3</units>
        <grade>4.00</grade>
      </subject>
      <subject subjectId="SUB-035">
        <subjectName>Practicum</subjectName>
        <units>6</units>
        <grade>3.00</grade>
      </subject>
    </enrolledSubjects>
    <gpa>3.25</gpa>
  </student>



  <!-- Student 11: Dummy Student -->
  <student studentId="23-00011">
    <firstName>Gabriela</firstName>
    <lastName>Sosa</lastName>
    <course>BSIS</course>
    <yearLevel>1</yearLevel>
    <enrolledSubjects>
      <subject subjectId="SUB-036">
        <subjectName>Machine Learning</subjectName>
        <units>3</units>
        <grade>1.00</grade>
      </subject>
      <subject subjectId="SUB-037">
        <subjectName>Accounting Principles</subjectName>
        <units>4</units>
        <grade>2.50</grade>
      </subject>
      <subject subjectId="SUB-038">
        <subjectName>Machine Learning</subjectName>
        <units>4</units>
        <grade>1.50</grade>
      </subject>
      <subject subjectId="SUB-039">
        <subjectName>Capstone Project 2</subjectName>
        <units>3</units>
        <grade>3.00</grade>
      </subject>
      <subject subjectId="SUB-040">
        <subjectName>System Administration</subjectName>
        <units>3</units>